{
  "schemaVersion": "0.1.0",
  "evidenceId": "evidence_synthetic_minimal",
  "kind": "observation",
  "capabilitySignal": "delivery.ci.generic",
  "source": {
    "class": "selected-local-repository",
    "sourceRelativeRef": "synthetic/workflow.yml",
    "repositoryRef": "repository_synthetic_a",
    "revisionRef": "revision_synthetic_a",
    "visibility": "local-only"
  },
  "authorAssessment": {
    "state": "unknown",
    "subjectRef": null
  },
  "freshness": {
    "observedAt": "2026-09-01T00:00:00Z",
    "collectedAt": "2026-09-04T00:00:00Z"
  },
  "strength": "weak",
  "limitations": ["Synthetic fixture with unknown authorship"],
  "extractor": {
    "name": "fixture.collector",
    "version": "0.1.0"
  },
  "invalidation": {
    "rule": "source-changed",
    "fingerprint": "fingerprint_synthetic_a"
  }
}
